{
  "$schema": "https://json-schema.org/draft/2020-12/schema",
  "$id": "urn:axiomlint:governance:constitutional-ratification:0.1",
  "title": "Source-bound actual principal ratification",
  "type": "object",
  "additionalProperties": false,
  "required": ["schema_version", "id", "decision", "decision_mode", "principal",
               "recorder", "conversation_id", "question", "answer", "response_time",
               "response_time_precision", "synchronization_observed_at_utc",
               "ratified_source_commit", "packet", "packet_sha256", "targets",
               "scope", "not_approved", "signature_claim"],
  "properties": {
    "schema_version": {"const": "0.1"},
    "id": {"const": "APR-001"},
    "decision": {"const": "APPROVED"},
    "decision_mode": {"const": "ACTUAL_PRINCIPAL_USER_RESPONSE"},
    "principal": {"const": "Michael Maillet"},
    "recorder": {"const": "Computer assistant, not impersonating the principal"},
    "conversation_id": {"const": "72131cdc-563c-4d43-a6b3-f37dd1253e0c"},
    "question": {"const": "Do you ratify the three identified documents and the bounded delegation described in the packet?"},
    "answer": {"const": "Ratify bounded delegation"},
    "response_time": {"const": "2026-10-20T21:12-03:00"},
    "response_time_precision": {"const": "MINUTE"},
    "synchronization_observed_at_utc": {"type": "string", "minLength": 1},
    "ratified_source_commit": {"const": "18facc06d4e37cb0629ec95c258cbe58da279dd4"},
    "packet": {"const": "governance/approvals/constitutional-ratification-packet.md"},
    "packet_sha256": {"const": "f1366760efbafc32b77f1221afdc1c77a945e295d16a5e4567a6563916880ee6"},
    "targets": {
      "const": [
        {"path": "governance/charter/CHARTER.md", "sha256": "956739508a8bc8e3a5d6f6364c2e350066e3675eb9a313212fc482b344d2dd76"},
        {"path": "governance/charter/AMD-001-local-only.md", "sha256": "64fb2c98c8f63365dfc5815e93cb137cee4d14f5fa186f1690feda64fdb5d512"},
        {"path": "governance/charter/AMD-002-delegated-decisions.md", "sha256": "f97d8ed7e18d5cb8398f9fe304268506b1bd05a42f8540516546fdadaf220e13"}
      ]
    },
    "scope": {"const": "Ratify the identified constitutional texts and activate their bounded prospective authority; no substantive unreviewed changes"},
    "not_approved": {
      "const": ["RETROACTIVE_APPROVAL_OR_FINDING_VERIFICATION", "PACKAGE_OR_PHASE_CLOSURE",
                "INDEPENDENT_AUDIT_OR_EXPERIMENT_RESULT", "MATERIAL_RISK_ACCEPTANCE",
                "RELEASE_OR_SENSITIVE_EXTERNAL_ACTION"]
    },
    "signature_claim": {"const": "NO_ELECTRONIC_SIGNATURE_ASSERTED"}
  }
}
